{
  "construct_slug": "artisan",
  "output_type": "Verdict",
  "verdict": {
    "score": 4,
    "axes": {"weight": 4, "rhythm": 5, "material": 3},
    "summary": "Surface meets craft baseline; consider tightening rhythm-weight coupling."
  },
  "invocation_mode": "room",
  "cycle_id": "simstim-20260509-aead9136",
  "persona": "ALEXANDER",
  "output_refs": [
    {"type": "verdict", "ref": "artisan:visual-surface:scoring", "hash": null}
  ],
  "evidence": [
    "grimoires/loa/sdd.md:42",
    "previous-handoff:abc123"
  ],
  "domain": "visual-surface",
  "agent_id": null,
  "transcript_path": null,
  "input_refs": [
    {"type": "artifact", "ref": "tests/fixtures/sample-surface.png", "hash": null}
  ],
  "open_questions": [],
  "gates_passed": [
    {"gate_name": "schema_valid", "status": "passed", "reason": null}
  ],
  "gates_failed": [],
  "composition_run_id": null,
  "stage_index": 0,
  "created_at": "2026-05-09T22:00:00Z",
  "why": {
    "rationale": "Surface scored 4/5 because structure (typographic hierarchy, modular scale) and behavior (state transitions correctly named) hold; motion is the weak axis — the 300ms ease-in-out implies a marketing surface, but the visual weight (oklch L=0.32 with chroma 0.08) implies stone, and stone settles, not eases. The chroma also exceeds institutional range. Both deltas are measurable, not subjective.",
    "decisions_considered": [
      {"option": "Score 5/5", "outcome": "rejected", "reason": "motion-weight coupling violates 'roughness' from Alexander 15"},
      {"option": "Score 3/5 due to chroma alone", "outcome": "rejected", "reason": "structure compensation prevents that downgrade"},
      {"option": "Defer to operator", "outcome": "rejected", "reason": "verdict has named principles, not preference"}
    ],
    "tools_used": [
      {"tool": "Read", "purpose": "load surface taste tokens", "count": 3},
      {"tool": "Grep", "purpose": "find motion declarations", "count": 1}
    ],
    "confidence": "high",
    "alternative_verdicts": [
      "If the operator's bias is marketing-surface, score is 4/5 and motion deltas are stylistic, not corrective."
    ]
  }
}
